movieid,title,outline,synopsis,keywords,tagline,genre,certificate,certificate_reason,certificate_body
tt7131622,"Quentin Tarantino&#39;s Once Upon a Time... in Hollywood visits 1969 Los Angeles, where everything is changing, as TV star Rick Dalton (Leonardo DiCaprio) and his longtime stunt double Cliff Booth (Brad Pitt) make their way around an industry they hardly recognize anymore. The ninth film from the writer-director features a large ensemble cast and multiple storylines in a tribute to the final moments of Hollywood&#39;s golden age.","As Hollywood&#39;s Golden Age is winding down during the summer of 1969, television actor Rick Dalton and his stunt double Cliff Booth endeavor to achieve lasting success in Hollywood while meeting several colorful characters along the way.","In February 1969, Hollywood actor Rick Dalton (Leonardo DiCaprio), former star of 1950s Western television series Bounty Law, laments to his best friend and former stunt double, Cliff Booth (Brad Pitt), that his career is over. Dalton got Bounty Law canceled by the networks as he wanted a movie career.
Dalton had his diving license taken away for too many drunk driving tickets and so Booth drives him everywhere now.<br/><br/>Dalton has lunch with Producer and Agent Marvin Schwarz (Al Pacino) who makes Dalton realize that playing a guest negative role in new network shows is going to ruin his career. Marvin says that the networks are playing an old trick and while Dalton thinks his guest character is being beaten up by the hero of the new show, the audience perceives that Dalton&#39;s character from Bounty Law is getting beaten up the hero of the new show. This would eventually lead to the end of Dalton&#39;s career as a leading man. Marvin wants Dalton to star in westerns in Italy.<br/><br/>Dalton realizes that he officially is designated as a &quot;has been&quot; and he does not want to star in Italian movies. Booth (a war veteran who lives in a trailer with his pit bull, Brandy) drives Dalton around town and relies on him for work due to rumors that Booth killed his wife Billie (Rebecca Gayheart) (and hence no producer would directly work with Booth due to his reputation). Randy Mille (Kurt Russell) refuses to hire Booth as he does not like the vibe that Booth brings on sets.
Booth encourages Dalton to seriously consider the movie offer in Italy.<br/><br/>Meanwhile, actress Sharon Tate (Margot Robbie) and her husband, director Roman Polanski (Rafal Zawierucha), have moved into the house next door to Dalton&#39;s. Polanski is the hottest director in the world at that time.
Dalton dreams of befriending the couple in order to restore his status as a movie lead. Later that night, Tate and Polanski join Jay Sebring (Emile Hirsch) (a Hollywood hairstylist and friend and ex-boyfriend of Tate) at a celebrity-filled party at the Playboy Mansion. Sebring still has feelings for Tate.<br/><br/>At Dalton&#39;s house, Booth reminisces on a sparring match he had on the set of The Green Hornet with Bruce Lee (Mike Moh). Bruce Lee claimed that if he had a match with Cassius Clay, he would beat Clay. Booth scoffed at the claim (and calls Bruce a glorified dancer) and Bruce challenged him to a fight. Booth is able to hold off Bruce and match him blow for blow.<br/><br/>While fixing the TV antenna atop Dalton&#39;s roof, Booth notices a hippie man, Charles Manson, arriving at the Polanski residence. Charles Manson (Damon Herriman) stops by the home of Polanski and Tate looking for record producer Terry Melcher, who used to live there, but is turned away by Sebring.<br/><br/>Later, while driving Dalton&#39;s car, Booth picks up a young hitchhiker called &quot;Pussycat&quot; (Margaret Qualley), dropping her off at Spahn Ranch, where Booth once filmed Bounty Law. &quot;Pussycat&quot; tries to persuade Booth to stay, but he is suspicious of the large number of hippies squatting on the property, and suspects they are taking advantage of the owner, George Spahn (Bruce Dern) (an 80-year-old nearly blind man who rented his ranch out for Westerns. Charles Manson convinced Spahn to allow him and his followers to live on the ranch).
Booth insists on checking on Spahn despite Squeaky&#39;s (Dakota Fanning) objections; Spahn dismisses Booth&#39;s fears. The other hippies include Katie (Madisen Beaty), Butterfly (Ruby Rose Skotchdopole), Blue (Kansas Bowling), Snake (Sydney Sweeney) and Froggie (Harley Quinn Smith).<br/><br/>Returning to the car, Booth discovers that Clem Grogan (James Landry Hébert) has slashed the front tire; Booth brutally beats Grogan and forces him to change the tire. One of the Manson girls, Sundance (Cassidy Vick Hice), goes to fetch Tex Watson (Austin Butler) the leader of the hippies, but by the time Watson arrives on horseback Booth is driving away. Tate goes for a walk and decides to stop at a movie theater to watch herself in The Wrecking Crew.<br/><br/>Dalton lands the role of a villain in a new series, Lancer, where he strikes up a conversation with his eight-year-old co-star, Trudi (Julia Butters). During one of his scenes, Dalton struggles with his dialogue due to his alcoholism. After having an emotional breakdown in his trailer, Dalton returns to the set and delivers a powerful performance that impresses the director, Sam Wanamaker (Nicholas Hammond), and Trudi, bolstering Dalton&#39;s confidence.<br/><br/>After watching Dalton&#39;s guest performance on an episode of The F.B.I., casting agent Marvin Schwarz offers Dalton the opportunity to shoot a Spaghetti Western in Italy. Dalton, who considers Spaghetti Westerns to be the bottom of the movie industry, reluctantly agrees, bringing Booth with him for the six-month stint. Dalton films four movies, including Nebraska Jim with Sergio Corbucci, and gets married to Italian starlet Francesca Capucci<br/><br/>Returning to Los Angeles, Dalton informs Booth he can no longer afford his services, and they agree to go their separate ways. Returning to Los Angeles on August 8, 1969, Dalton and Booth go out drinking to commemorate their time together. They return to Dalton&#39;s home, where Booth smokes an acid-laced cigarette and takes Brandy for a walk.<br/><br/>Meanwhile, Tex Watson, Susan Atkins (Mikey Madison), Linda Kasabian (Maya Hawke), and Patricia Krenwinkel (Madisen Beaty) park outside, in their loud 1959 Ford Galaxie, in preparation to murder everyone in Tate&#39;s house (their cult leader Charles Manson apparently had told Tex Watson to go to &quot;Terry&#39;s old house&quot; (where Tate now stays) and kill everyone inside). Dalton hears the car, comes out, and angrily orders them to leave.<br/><br/>They drive off, but Atkins hatches a plan to return and kill Dalton instead. Kasabian deserts the group and the remaining three proceed with Atkins&#39; plan. They break into Dalton&#39;s house and confront Booth, who recognizes them from Spahn Ranch. Booth orders Brandy to attack, and together they kill Krenwinkel and Watson and severely injure Atkins.<br/><br/>Atkins, gun in hand, stumbles outside, alarming Dalton, who was listening to music on headphones and oblivious to the mayhem inside. Dalton retrieves a flamethrower he had kept from a film shoot and incinerates Atkins. Booth is taken to the hospital for injuries. Sebring engages Dalton in conversation and Tate, over the intercom, invites Dalton up to her house for drinks with her still-alive house-guests, Sebring, Abigail Folger (Samantha Robinson) and Wojciech Frykowski (Costa Ronin).","hollywood-california, place-in-title, violence, film-within-a-film, actor-as-protagonist","The 9th Film from Quentin Tarantino.",Comedy,R,"Rated R for language throughout, some strong graphic violence, drug use, and sexual references",MPAA
