movieid,id,body,interest_score_users_voted,interest_score_users_interested,category_id,category_text
tt7131622,tr5060613,"The real life sister of Sharon Tate was so moved by Margot Robbie&#39;s portrayal of Tate she claimed she &quot;cried real tears, I had a big wet patch of tears down the front of my shirt. It was like having my sister back again, after 50 years.&quot;",381,371,uncategorized,Uncategorized
tt7131622,tr4548511,"<a class=""ipc-md-link ipc-md-link--entity"" href=""/name/nm0000233/?ref_=tttrv_tr"">Quentin Tarantino</a> spent five years writing Once Upon a Time in Hollywood as a novel before realizing a film script would better suit the material.",921,889,uncategorized,Uncategorized
tt7131622,tr3502809,"<a class=""ipc-md-link ipc-md-link--entity"" href=""/name/nm0000233/?ref_=tttrv_tr"">Quentin Tarantino</a> was scheduled to make the film for The Weinstein Company but severed the ties when the sexual assault allegations against co-chairman <a class=""ipc-md-link ipc-md-link--entity"" href=""/name/nm0005544/?ref_=tttrv_tr"">Harvey Weinstein</a> were revealed in the press. To avoid a repeat of the script leak incident that almost cost him <a class=""ipc-md-link ipc-md-link--entity"" href=""/title/tt3460252/?ref_=tttrv_tr"">The Hateful Eight (2015)</a>, he wrote a memo to all theatrical studios, summoning them to send one representative to his agent&#39;s (The William Morris Endeavor) office in Beverly Hills to read his Manson script in person at an arranged time and date. The memo also mandated that each representative was required to sign a heavy non-disclosure agreement, read the script in person (they were not allowed to copy or take the script back), and present the list of demands and conditions to the studio management. This project was already one of the most anticipated and promising projects on the board at the time. After reading the script, Warner Bros., Universal Pictures, Sony Pictures, Paramount Pictures, Annapurna Pictures, and Lionsgate were welcome to make a bid for the theatrical rights before a second round of bids pitched to Tarantino himself. Sony won the theatrical rights in the bidding war, outbidding its closest rival Warner Bros., making it the first David Heyman production not to be distributed by Warner.",1459,1404,uncategorized,Uncategorized
tt7131622,tr4983072,"The TV at George Spahn&#39;s house has one of the earliest unwired remote controls, the Zenith &quot;Space Command&quot; remote. Rather than using infrared or similar technology from later years, it uses ultra high frequency sound. The remote features four buttons, each which trips a spring-loaded hammer that strikes a metal reed. Each of the reeds is at a separate pitch, all of which are inaudible. One button was for turning the TV on, another for turning it off, one for raising the channel and one for lowering it. As each button press makes a loud click, many people simply referred to the device as a &quot;clicker&quot;. A rather humorous failing of this system is that if you jingled your car keys it could cause the TV to turn on.",342,333,uncategorized,Uncategorized
tt7131622,tr6274856,"<a class=""ipc-md-link ipc-md-link--entity"" href=""/name/nm0000233/?ref_=tttrv_tr"">Quentin Tarantino</a> forbid the actors to use smartphones between takes on set, to preserve the period feel.",73,73,uncategorized,Uncategorized
